department,question,answer,question_type,choices,source_document
DOE,"What is Goal 1 of the DOE Strategic Plan FY 2022–2026, and what emissions targets does it set?","Goal 1 is 'Drive U.S. Energy Innovation and Deployment on a Path to Net‑Zero Emissions by 2050,' with interim targets of reducing greenhouse gas emissions by 50–52% below 2005 levels by 2030.",freeform,,https://www.energy.gov/sites/default/files/2022-04/doe-2022-strategic-plan.pdf
DOE,Which group did DOE explicitly engage for input while developing its FY 2022–2026 Strategic Plan?,Indian tribes and Alaska Native organizations,multiple_choice,A) Private-sector unrelated to energy | B) Indian tribes and Alaska Native organizations | C) Overseas foreign NGOs | D) State public school systems,https://www.energy.gov/sites/default/files/2022-04/doe-2022-strategic-plan.pdf
DOE,What are the five main focus areas of the DOE’s FY 2025 budget request?,"Clean energy leadership, investing in underserved communities, cutting-edge clean energy R&D, advancing climate goals, and strengthening energy and national security.",freeform,,https://www.energy.gov/sites/default/files/2024-03/doe-fy25-budget-in-brief.pdf
DOE,"How much funding was requested for EERE in FY 2025, and what was the percentage increase over FY 2024?","$3.869B, +11.8%",multiple_choice,"A) $3.5B, +8% | B) $3.869B, +11.8% | C) $4.2B, +15% | D) $2.9B, +5%",https://crsreports.congress.gov/product/pdf/IF/IF12331
DOE,Which EERE office had a 260% budget increase in the FY 2025 request?,OCED (Clean Energy Demonstrations),multiple_choice,A) FEMP | B) MESC | C) OCED (Clean Energy Demonstrations) | D) SCEP,https://www.energy.gov/eere/articles/fy-2025-budget-request-summary
DOE,Describe the key cybersecurity approach outlined in the DOE/NNSA IT Modernization Strategy.,"Cybersecurity is treated as foundational, with enterprise risk management, tailored protections, and risk-aware operations across classified and unclassified environments.",freeform,,https://www.energy.gov/sites/default/files/2021-01/NNSA-DOE-IT-Modernization-Strategy.pdf
DOE,The DOE OCIO FY 2024–2029 IT Strategy emphasizes transforming IT architecture to be:,"Modern, flexible, and cost-effective",multiple_choice,"A) More centralized and less transparent | B) Modern, flexible, and cost-effective | C) Legacy-only systems | D) Government-owned hardware only",https://www.energy.gov/cio/downloads/fy24-29-it-strategic-plan
DOE,What is the mission of the DOE Office of Inspector General as detailed in its FY 2022–2026 Strategic Plan?,"Strengthen the integrity, economy, and efficiency of DOE programs and operations through oversight, audits, and evaluations.",freeform,,https://www.energy.gov/ig/downloads/strategic-plan-2022-2026
DOE,How does the DOE 2024–2027 Climate Adaptation Plan aim to strengthen battery supply chain resilience?,"By funding battery materials refining, production plants, and recycling facilities to diversify supply chains and reduce climate vulnerability.",freeform,,https://www.energy.gov/sites/default/files/2024-03/doe-climate-adaptation-plan-2024.pdf
DOE,Which resource-intensive technology is specifically mentioned as requiring resilience strategies due to drought?,Semiconductors,multiple_choice,A) Wind turbines | B) Solar panels | C) Semiconductors | D) Hydropower dams,https://www.energy.gov/sites/default/files/2024-03/doe-climate-adaptation-plan-2024.pdf
DOE,What is the primary mission of the U.S. Department of Energy (DOE)?,"To ensure America’s security and prosperity by addressing its energy, environmental, and nuclear challenges through transformative science and technology solutions.",freeform,,https://www.energy.gov/about
DOE,Which of the following federal responsibilities is managed by the DOE?,Maintaining the nation's nuclear weapons stockpile,multiple_choice,A) Overseeing the FBI | B) Setting healthcare prices | C) Maintaining the nation's nuclear weapons stockpile | D) Funding the U.S. Coast Guard,https://www.energy.gov/about
DOE,How does the DOE collaborate with the Department of Defense (DoD)?,"DOE collaborates with DoD primarily through the National Nuclear Security Administration (NNSA), supporting the U.S. nuclear deterrent and nonproliferation programs.",freeform,,https://www.energy.gov/nnsa/national-nuclear-security-administration
DOE,Which of these best describes how DOE and DOJ intersect operationally?,"DOE and DOJ may coordinate on cybersecurity, intellectual property protection, and legal enforcement of environmental and energy regulations.",multiple_choice,A) No interaction | B) Collaborate on immigration | C) Coordinate on cyber and energy-related enforcement | D) Co-manage nuclear waste facilities,https://www.justice.gov/opa/pr/justice-and-energy-departments-announce-joint-effort-combat-energy-industry-cyber-threats
DOE,What role do DOE national laboratories play in federal interagency research efforts?,"DOE labs often lead or support cross-agency innovation efforts in fields such as climate science, artificial intelligence, advanced materials, and bioenergy.",freeform,,https://www.energy.gov/national-labs
DOE,What are the three strategic priorities identified in DOE’s AI Risk Management Framework alignment?,"Transparency, accountability, and human oversight.",freeform,,https://www.energy.gov/sites/default/files/2023-12/AI_Governance_Framework_DOE.pdf
DOE,How does the Department of Energy define 'transformative energy technologies' under ARPA-E?,"Technologies that can radically improve U.S. economic prosperity, energy security, and environmental well-being.",freeform,,https://arpa-e.energy.gov/
DOE,What are the goals of DOE's Clean Energy Corps recruitment effort?,"To hire a diverse, mission-driven workforce focused on deploying clean energy, advancing climate goals, and strengthening U.S. infrastructure.",freeform,,https://www.energy.gov/CleanEnergyCorps
DOE,How does DOE define 'energy justice' in its Justice40 commitments?,"Fair distribution of energy benefits and burdens, ensuring disadvantaged communities receive at least 40% of the overall benefits from federal investments.",freeform,,https://www.energy.gov/diversity/justice40-initiative
DOE,How does DOE use Technical Assistance Programs to support state energy offices?,"By providing guidance on energy efficiency, program implementation, and workforce training related to IRA and BIL funding.",freeform,,https://www.energy.gov/scep/state-and-community-energy-programs-office
DOE,What is the function of the Office of Clean Energy Demonstrations (OCED)?,OCED funds and implements large-scale demonstration projects for emerging clean energy technologies.,freeform,,https://www.energy.gov/oced/office-clean-energy-demonstrations
DOE,Why does DOE prioritize grid resilience in its climate adaptation plans?,"To protect critical infrastructure from climate-induced disruptions like wildfires, storms, and extreme temperatures.",freeform,,https://www.energy.gov/policy/articles/doe-climate-adaptation-plan
DOE,What is the purpose of DOE's Loan Programs Office?,To provide financing for innovative clean energy projects that accelerate deployment and commercialization.,freeform,,https://www.energy.gov/lpo/loan-programs-office
DOE,How does DOE incorporate Tribal consultation into clean energy initiatives?,By holding government-to-government consultations and including tribal interests in program design and implementation.,freeform,,https://www.energy.gov/indianenergy/policy-and-programs
DOE,Describe the relationship between DOE and the Office of Science.,The Office of Science is DOE’s largest supporter of basic research in physical sciences and oversees national laboratories.,freeform,,https://science.osti.gov/
DOE,How does DOE measure success in its Community Benefits Plans?,"Using metrics such as job creation, local investment, and inclusion of disadvantaged communities.",freeform,,https://www.energy.gov/diversity/community-benefits-plans
DOE,What role do carbon management technologies play in DOE’s decarbonization goals?,"They enable the capture, storage, and utilization of CO2 to reduce emissions in hard-to-abate sectors.",freeform,,https://www.energy.gov/fecm/carbon-management
DOE,How does DOE’s Industrial Efficiency and Decarbonization Office support manufacturing?,It funds projects that improve energy efficiency and reduce GHG emissions in industrial processes.,freeform,,https://www.energy.gov/eere/amo/industrial-efficiency-and-decarbonization-office
DOE,What is the function of DOE’s Grid Deployment Office?,To coordinate investment and modernization of the U.S. electric grid to ensure reliability and clean energy integration.,freeform,,https://www.energy.gov/gdo/grid-deployment-office
DOE,What does DOE's Carbon Negative Shot aim to achieve?,It targets scalable carbon dioxide removal solutions that cost less than $100/ton by 2032.,freeform,,https://www.energy.gov/fecm/carbon-negative-shot
DOE,What types of projects are eligible for DOE’s Energy Efficiency and Conservation Block Grant Program?,"Projects that reduce energy use, improve energy efficiency, and support local clean energy goals.",freeform,,https://www.energy.gov/scep/energy-efficiency-and-conservation-block-grant-program
DOE,What is the cost target of DOE’s Carbon Negative Shot initiative?,$100/ton,multiple_choice,A) $10/ton | B) $50/ton | C) $100/ton | D) $200/ton,https://www.energy.gov/fecm/carbon-negative-shot
DOE,Which office oversees clean hydrogen hub implementation?,OCED,multiple_choice,A) SCEP | B) LPO | C) OCED | D) ARPA-E,https://www.energy.gov/oced
DOE,What proportion of clean energy investments must benefit disadvantaged communities under Justice40?,40%,multiple_choice,A) 10% | B) 25% | C) 40% | D) 60%,https://www.energy.gov/diversity/justice40-initiative
DOE,What type of research does ARPA-E typically fund?,"High-risk, high-reward energy innovation",multiple_choice,"A) Basic science | B) Risk mitigation | C) Regulatory planning | D) High-risk, high-reward energy innovation",https://arpa-e.energy.gov/
DOE,Which program provides direct financial assistance to state and local governments for energy efficiency?,Energy Efficiency and Conservation Block Grant Program,multiple_choice,A) State Energy Program | B) EECBG | C) IRA Rebate | D) Weatherization Program,https://www.energy.gov/scep/energy-efficiency-and-conservation-block-grant-program
DOE,Which technology area is a core focus of the Industrial Efficiency and Decarbonization Office?,Thermal process electrification,multiple_choice,A) Electric vehicles | B) Smart meters | C) Thermal process electrification | D) Blockchain,https://www.energy.gov/eere/amo/industrial-efficiency-and-decarbonization-office
DOE,What role does the Grid Deployment Office play?,Modernizes and expands the national electricity grid,multiple_choice,A) Weather prediction | B) Pipeline regulation | C) Grid modernization | D) Nuclear safety,https://www.energy.gov/gdo/grid-deployment-office
DOE,Which of the following is a focus of the Clean Energy Corps?,Workforce recruitment for climate and energy initiatives,multiple_choice,A) Court representation | B) Federal employee relocation | C) Workforce recruitment for climate and energy initiatives | D) Veteran pension reform,https://www.energy.gov/CleanEnergyCorps
DOE,Who manages DOE’s community benefits framework?,Office of Economic Impact and Diversity,multiple_choice,A) OCED | B) LPO | C) ARPA-E | D) Office of Economic Impact and Diversity,https://www.energy.gov/diversity/community-benefits-plans
